{"azure":{"admin_username":"sparkoperator","image":"REPLACE-WITH-EXACT-PRIVATE-COMPUTE-GALLERY-IMAGE-VERSION","location":"eastus2","name_prefix":"tg-cpu","nodes":1,"os_disk_size_gb":256,"resource_group":"tg-production","sku":"Standard_EC96as_v6","ssh_public_key":{"path":"/srv/sparkinterval-operator/keys/operator.pub","sha256":"0000000000000000000000000000000000000000000000000000000000000000","size_bytes":0},"subnet_id":"/subscriptions/REPLACE-SUBSCRIPTION/resourceGroups/tg-network/providers/Microsoft.Network/virtualNetworks/tg-private/subnets/cpu","subscription_id":"REPLACE-SUBSCRIPTION","zone":"1"},"kind":"sparkinterval.azure.cpu.portfolio-materializer-site.v1","lean_namespace":"ReviewedTernaryGoldbachCPU","managed_hsm":{"key_id":"REPLACE-PRODUCTION-KEY-ID","key_manifest":{"path":"/srv/sparkinterval-operator/keys/trusted-compute-keys.json","sha256":"0000000000000000000000000000000000000000000000000000000000000000","size_bytes":0},"key_uri":"https://replace-managed-hsm.managedhsm.azure.net/keys/ternary-goldbach/00000000000000000000000000000000","public_key":{"path":"/srv/sparkinterval-operator/keys/production-public.pem","sha256":"0000000000000000000000000000000000000000000000000000000000000000","size_bytes":0}},"output_root":"/srv/sparkinterval-operator/materialized/cpu","policies":{"composite_appraisal":{"classification":"production","path":"/srv/sparkinterval-operator/policies/azure-cpu-composite.json","policy_id":"sparkinterval.composite.azure-cpu.production.v1","sha256":"0000000000000000000000000000000000000000000000000000000000000000","size_bytes":0},"evidence_verifier":{"path":"/srv/sparkinterval-operator/bin/verify-azure-cpu-evidence","sha256":"0000000000000000000000000000000000000000000000000000000000000000","size_bytes":0},"runner":{"classification":"production","path":"/srv/sparkinterval-operator/policies/measured-runner.json","policy_id":"sparkinterval.runner.azure-cpu.production.v1","sha256":"0000000000000000000000000000000000000000000000000000000000000000","size_bytes":0},"transcript_policy_id":"sparkinterval.transcript.ternary-goldbach.azure-cpu.production.v1"},"schema_version":1,"worker":{"guest_root":"/srv/sparkinterval-worker","maa_attestation_url":"https://replace.eus2.attest.azure.net/attest/SevSnpVm?api-version=2022-08-01"}}
